{
  "schemaVersion": 1,
  "kind": "review-facts",
  "collectedAt": "2026-10-16T12:00:00Z",
  "repository": "dgaspard/AI-SDLC-ATDD-SoftwareFactory",
  "pullRequest": {
    "number": 42,
    "author": "ai-sdlc-bdd-agent[bot]",
    "headSha": "1111111111111111111111111111111111111111",
    "baseRef": "main",
    "upToDate": true,
    "draft": false,
    "labels": []
  },
  "changedFiles": ["services/customer/server.js", "docs/design/example.md"],
  "checkRuns": [
    { "name": "Protected specs and tests unchanged", "headSha": "1111111111111111111111111111111111111111", "status": "completed", "conclusion": "success", "completedAt": "2026-10-16T11:50:00Z" },
    { "name": "Delivery spec", "headSha": "1111111111111111111111111111111111111111", "status": "completed", "conclusion": "success", "completedAt": "2026-10-16T11:51:00Z" },
    { "name": "Application suite", "headSha": "1111111111111111111111111111111111111111", "status": "completed", "conclusion": "success", "completedAt": "2026-10-16T11:58:00Z" }
  ],
  "approverEnabled": true
}
